{
  "run_id": "beam-summing-caseworst",
  "status": "ok",
  "samples": {
    "abs_log_error_t1": [
      [
        16.0,
        7.958078640513122e-13
      ],
      [
        64.0,
        7.389644451905042e-13
      ],
      [
        256.0,
        7.389644451905042e-13
      ]
    ],
    "abs_log_error_t2": [
      [
        16.0,
        5.115907697472721e-13
      ],
      [
        64.0,
        4.547473508864641e-13
      ],
      [
        256.0,
        4.547473508864641e-13
      ]
    ]
  },
  "errors": {
    "max_particles_over_m": 0.0,
    "max_abs_log_error": 7.958078640513122e-13
  },
  "tolerance": 1e-09,
  "pass": true
}
