{
  "run_id": "beam-swor-adaptive-caseworst",
  "status": "ok",
  "samples": {
    "rel_rmse_t1": [
      [
        16.0,
        7.958078640513122e-13
      ],
      [
        64.0,
        7.958078640513122e-13
      ],
      [
        256.0,
        7.958078640513122e-13
      ]
    ],
    "sd_log_z_t1": [
      [
        16.0,
        0.0
      ],
      [
        64.0,
        0.0
      ],
      [
        256.0,
        0.0
      ]
    ],
    "rel_rmse_t2": [
      [
        16.0,
        4.547473508864641e-13
      ],
      [
        64.0,
        4.547473508864641e-13
      ],
      [
        256.0,
        4.547473508864641e-13
      ]
    ],
    "sd_log_z_t2": [
      [
        16.0,
        0.0
      ],
      [
        64.0,
        0.0
      ],
      [
        256.0,
        0.0
      ]
    ]
  },
  "errors": {
    "max_particles_over_m": 0.0,
    "max_z": 0.0,
    "pooled_z": 0.0,
    "worst_rmse_ratio": 1.0
  },
  "tolerance": 4.0,
  "pass": true
}
