{
  "run_id": "beam-swor-casebigram",
  "status": "ok",
  "samples": {
    "rel_rmse_t1": [
      [
        16.0,
        0.13163727236069572
      ],
      [
        64.0,
        0.061415241802022
      ],
      [
        256.0,
        0.024129408213140066
      ]
    ],
    "sd_log_z_t1": [
      [
        16.0,
        0.13403410918029318
      ],
      [
        64.0,
        0.062092348052568115
      ],
      [
        256.0,
        0.024131420035019384
      ]
    ],
    "rel_rmse_t2": [
      [
        16.0,
        0.16119060337547803
      ],
      [
        64.0,
        0.06371598489359678
      ],
      [
        256.0,
        0.03251539642954472
      ]
    ],
    "sd_log_z_t2": [
      [
        16.0,
        0.16217053434898063
      ],
      [
        64.0,
        0.0633272853977813
      ],
      [
        256.0,
        0.0323853431854194
      ]
    ],
    "rel_rmse_t3": [
      [
        16.0,
        0.14358165961772576
      ],
      [
        64.0,
        0.05324180840811053
      ],
      [
        256.0,
        0.01927223174247782
      ]
    ],
    "sd_log_z_t3": [
      [
        16.0,
        0.14693792284846416
      ],
      [
        64.0,
        0.05377122819848348
      ],
      [
        256.0,
        0.019103658564321325
      ]
    ]
  },
  "errors": {
    "max_particles_over_m": 0.0,
    "max_z": 1.8568208501777455,
    "pooled_z": 3.111654432523179,
    "worst_rmse_ratio": 0.20172017319026486,
    "min_sd_log_z": 0.019103658564321325
  },
  "tolerance": 4.0,
  "pass": true
}
