{
  "run_id": "beam-swor-adaptive-casebigram",
  "status": "ok",
  "samples": {
    "rel_rmse_t1": [
      [
        16.0,
        0.13163727236069572
      ],
      [
        64.0,
        0.061415241802022
      ],
      [
        256.0,
        0.023533094721334503
      ]
    ],
    "sd_log_z_t1": [
      [
        16.0,
        0.13403410918029318
      ],
      [
        64.0,
        0.062092348052568115
      ],
      [
        256.0,
        0.0237135302647321
      ]
    ],
    "rel_rmse_t2": [
      [
        16.0,
        0.15516517243499042
      ],
      [
        64.0,
        0.0731784542229987
      ],
      [
        256.0,
        0.026862437454335614
      ]
    ],
    "sd_log_z_t2": [
      [
        16.0,
        0.15849841899410036
      ],
      [
        64.0,
        0.07303635533858974
      ],
      [
        256.0,
        0.026724866020944763
      ]
    ],
    "rel_rmse_t3": [
      [
        16.0,
        0.12948702067628104
      ],
      [
        64.0,
        0.05701126232310789
      ],
      [
        256.0,
        0.020067740485175654
      ]
    ],
    "sd_log_z_t3": [
      [
        16.0,
        0.1319668931793029
      ],
      [
        64.0,
        0.056883553234717145
      ],
      [
        256.0,
        0.02001426722801326
      ]
    ]
  },
  "errors": {
    "max_particles_over_m": 0.0,
    "max_z": 2.112693456147854,
    "pooled_z": 1.2096688848990078,
    "worst_rmse_ratio": 0.17877227550607483,
    "min_rel_sd": 0.020105043749710165
  },
  "tolerance": 4.0,
  "pass": true
}
