{
  "run_id": "beam-summing-casebigram",
  "status": "ok",
  "samples": {
    "share_t1": [
      [
        16.0,
        0.9845212048805262
      ],
      [
        64.0,
        0.9845212048805262
      ],
      [
        256.0,
        0.9845212048805262
      ]
    ],
    "share_t2": [
      [
        16.0,
        0.984075384718875
      ],
      [
        64.0,
        0.984075384718875
      ],
      [
        256.0,
        0.984075384718875
      ]
    ],
    "share_t3": [
      [
        16.0,
        0.9859721862281623
      ],
      [
        64.0,
        0.9859721862281623
      ],
      [
        256.0,
        0.9859721862281623
      ]
    ]
  },
  "errors": {
    "max_overshoot": -0.014027813771837705,
    "max_rel_diff_from_fig1": 0.0
  },
  "tolerance": 1e-09,
  "pass": true
}
